{
  "anchor_id": "GEN.10:31",
  "canon_uri": "canon/OT/GEN.md#GEN.10:31",
  "text_tradition": "LXX",
  "generated_at": "2026-03-13T21:28:41+00:00",
  "generator_version": "phase3-backlinks-v1",
  "links": [
    {
      "source_file": "staging/validated/OT/JDT_footnotes.md",
      "line_number": 192,
      "raw_match": "[[GEN.10:21]]-31",
      "reference_type": "wikilink_range",
      "context": "The Chaldeans were a Semitic people ([[GEN.10:21]]-31) who settled the area just"
    }
  ]
}
