{
  "anchor_id": "1CH.23:10",
  "canon_uri": "canon/OT/1CH.md#1CH.23:10",
  "text_tradition": "LXX",
  "generated_at": "2026-03-13T21:28:41+00:00",
  "generator_version": "phase3-backlinks-v1",
  "links": [
    {
      "source_file": "staging/validated/NT/LUK_footnotes.md",
      "line_number": 65,
      "raw_match": "[[1CH.23:3]]-11",
      "reference_type": "wikilink_range",
      "context": "Each priest was assigned to a division (see [[1CH.23:3]]-11; 28:13). There were"
    }
  ]
}
