{
  "anchor_id": "ROM.15:19",
  "canon_uri": "canon/NT/ROM.md#ROM.15:19",
  "text_tradition": "LXX",
  "generated_at": "2026-03-13T21:28:41+00:00",
  "generator_version": "phase3-backlinks-v1",
  "links": [
    {
      "source_file": "staging/validated/NT/2CO_footnotes.md",
      "line_number": 767,
      "raw_match": "[[ROM.15:19]]",
      "reference_type": "wikilink",
      "context": "By signs of an apostle (v. 12; see [[ROM.15:19]]; [[1CO.2:4]]; 4:20; 12:28, 29; [[HEB.2:4]])"
    }
  ]
}
