{
  "anchor_id": "1CO.9:22",
  "canon_uri": "canon/NT/1CO.md#1CO.9:22",
  "text_tradition": "LXX",
  "generated_at": "2026-03-13T21:28:41+00:00",
  "generator_version": "phase3-backlinks-v1",
  "links": [
    {
      "source_file": "staging/validated/NT/ACT_footnotes.md",
      "line_number": 2045,
      "raw_match": "[[1CO.9:1]]-23",
      "reference_type": "wikilink_range",
      "context": "([[1CO.9:1]]-23), he has not required this for himself from the communities he established."
    },
    {
      "source_file": "staging/validated/NT/LUK_footnotes.md",
      "line_number": 863,
      "raw_match": "[[1CO.9:19]]-23",
      "reference_type": "wikilink_range",
      "context": "He draws the fishermen with fish (see [[1CO.9:19]]-23)."
    }
  ]
}
