{
  "anchor_id": "LUK.8:17",
  "canon_uri": "canon/NT/LUK.md#LUK.8:17",
  "text_tradition": "LXX",
  "generated_at": "2026-03-13T21:28:41+00:00",
  "generator_version": "phase3-backlinks-v1",
  "links": [
    {
      "source_file": "staging/validated/OT/EST_footnotes.md",
      "line_number": 339,
      "raw_match": "[[LUK.8:17]]",
      "reference_type": "wikilink",
      "context": "(see also [[LUK.8:17]])."
    }
  ]
}
