{
  "anchor_id": "DEU.17:9",
  "canon_uri": "canon/OT/DEU.md#DEU.17:9",
  "text_tradition": "LXX",
  "generated_at": "2026-03-13T21:28:41+00:00",
  "generator_version": "phase3-backlinks-v1",
  "links": [
    {
      "source_file": "staging/validated/OT/EXO_articles.md",
      "line_number": 43,
      "raw_match": "[[DEU.17:8]]-13",
      "reference_type": "wikilink_range",
      "context": "The Hebrew word for 'priest' is kohen. He is the Levite who stood as intercessor for the people before God. Old Testament priests offered up gifts and sacrifices to the Lord on behalf of the people, that they might be reconciled to Him. The Lord directed Moses to construct the tabernacle ([[EXO.25:1]]-27:21). Then He established a permanent, hereditary priesthood, beginning with Moses' brother Aaron and continuing through Aaron's sons ([[EXO.28:1]]). The priests were sanctified, or consecrated, with holy oil ([[EXO.30:22]]-30). Their holy garments of finely woven and richly decorated material were for the honor and glory of God (Ex 28:2-39). After Aaron's death, 'the Lord separated the tribe of Levi [Aaron's tribe] to bear the ark of the covenant of the Lord, to stand before the Lord, to minister to Him, and to bless in His name' ([[DEU.10:8]]). Besides the various sacrifices, the priests blessed the people ([[NUM.6:23]]-25), maintained the tabernacle (later, the temple) and its grounds ([[NUM.18:1]]-7), received tithes and offerings ([[NUM.18:8]]-32), supervised purification procedures (Lv 13:1-14:57), acted as judges ([[DEU.17:8]]-13) and taught the Law ([[DEU.33:8]]-11). Only male Levites administered the liturgical rites. #### New Testament Priests"
    }
  ]
}
