{
  "anchor_id": "ROM.9:8",
  "canon_uri": "canon/NT/ROM.md#ROM.9:8",
  "text_tradition": "LXX",
  "generated_at": "2026-03-13T21:28:41+00:00",
  "generator_version": "phase3-backlinks-v1",
  "links": [
    {
      "source_file": "staging/validated/OT/GEN_footnotes.md",
      "line_number": 1076,
      "raw_match": "[[ROM.9:8]]",
      "reference_type": "wikilink",
      "context": "counted as Abraham's seed ([[ROM.9:8]]). These children are those who embrace Abraham's"
    }
  ]
}
