{
  "anchor_id": "MAT.27:5",
  "canon_uri": "canon/NT/MAT.md#MAT.27:5",
  "text_tradition": "LXX",
  "generated_at": "2026-03-13T21:28:41+00:00",
  "generator_version": "phase3-backlinks-v1",
  "links": [
    {
      "source_file": "staging/validated/NT/ACT_footnotes.md",
      "line_number": 87,
      "raw_match": "[[MAT.27:3]]-5",
      "reference_type": "wikilink_range",
      "context": "See [[MAT.27:3]]-5. Though the accounts may seem to differ, Luke's report here is merely"
    }
  ]
}
