{
  "anchor_id": "ROM.9:12",
  "canon_uri": "canon/NT/ROM.md#ROM.9:12",
  "text_tradition": "LXX",
  "generated_at": "2026-03-13T21:28:41+00:00",
  "generator_version": "phase3-backlinks-v1",
  "links": [
    {
      "source_file": "staging/validated/OT/MAL_footnotes.md",
      "line_number": 32,
      "raw_match": "[[ROM.9:10]]-13",
      "reference_type": "wikilink_range",
      "context": "Jacob, not of indicating hatred for the unchosen (see [[GEN.25:23]]; [[LUK.14:26]]; [[ROM.9:10]]-13)."
    }
  ]
}
