{
  "anchor_id": "ROM.7:15",
  "canon_uri": "canon/NT/ROM.md#ROM.7:15",
  "text_tradition": "LXX",
  "generated_at": "2026-03-13T21:28:41+00:00",
  "generator_version": "phase3-backlinks-v1",
  "links": [
    {
      "source_file": "staging/validated/OT/JOB_footnotes.md",
      "line_number": 457,
      "raw_match": "[[ROM.7:13]]-25",
      "reference_type": "wikilink_range",
      "context": "difficult to avoid involuntary sin (see 14:17-22 and note; [[ROM.7:13]]-25 and notes). \"For"
    }
  ]
}
