{
  "anchor_id": "MRK.1:14",
  "canon_uri": "canon/NT/MRK.md#MRK.1:14",
  "text_tradition": "LXX",
  "generated_at": "2026-03-13T21:28:41+00:00",
  "generator_version": "phase3-backlinks-v1",
  "links": [
    {
      "source_file": "staging/validated/NT/LUK_footnotes.md",
      "line_number": 1091,
      "raw_match": "[[MRK.1:14]]",
      "reference_type": "wikilink",
      "context": "John the Baptist was imprisoned soon after Jesus was baptized ([[MRK.1:14]])."
    },
    {
      "source_file": "staging/validated/OT/EZK_footnotes.md",
      "line_number": 110,
      "raw_match": "[[MRK.1:14]]",
      "reference_type": "wikilink",
      "context": "prophet, was put in prison ([[MRK.1:14]]); and his father, Zacharias, had his tongue bound"
    }
  ]
}
