{
  "anchor_id": "GEN.24:27",
  "canon_uri": "canon/OT/GEN.md#GEN.24:27",
  "text_tradition": "LXX",
  "generated_at": "2026-03-13T21:28:41+00:00",
  "generator_version": "phase3-backlinks-v1",
  "links": [
    {
      "source_file": "staging/validated/OT/SIR_footnotes.md",
      "line_number": 1413,
      "raw_match": "[[GEN.24:1]]-67",
      "reference_type": "wikilink_range",
      "context": "would accept to marry. As with Isaac and Rebekah, for example ([[GEN.24:1]]-67), marriages"
    }
  ]
}
