{
  "anchor_id": "JDG.7:14",
  "canon_uri": "canon/OT/JDG.md#JDG.7:14",
  "text_tradition": "LXX",
  "generated_at": "2026-03-13T21:28:41+00:00",
  "generator_version": "phase3-backlinks-v1",
  "links": [
    {
      "source_file": "staging/validated/OT/ISA_footnotes.md",
      "line_number": 188,
      "raw_match": "[[JDG.7:9]]-25",
      "reference_type": "wikilink_range",
      "context": "without the use of weapons (see [[JDG.7:9]]-25). These men prefigure the apostles, who"
    }
  ]
}
