{
  "anchor_id": "LUK.10:8",
  "canon_uri": "canon/NT/LUK.md#LUK.10:8",
  "text_tradition": "LXX",
  "generated_at": "2026-03-13T21:28:41+00:00",
  "generator_version": "phase3-backlinks-v1",
  "links": [
    {
      "source_file": "staging/validated/NT/LUK_articles.md",
      "line_number": 33,
      "raw_match": "[[LUK.10:1]]-17",
      "reference_type": "wikilink_range",
      "context": "In [[LUK.10:1]]-17, the Lord appoints seventy men to go out as missionaries-as apostles. Though not so prominent as the Twelve, the Seventy carried out their missions with fervor and enthusiasm. The Tradition of the Church confirms that the Seventy remained true to the Lord and their calling, fulfilling a vital role in the spread of the gospel. These were not random choices or accidental volunteers but true disciples, true apostles, whose labors carried the message of their Lord throughout the Roman Empire and beyond. Though lists of the Seventy vary somewhat, all these men are remembered in the calendar of the Church (see chart, 'The Seventy,'). One day, January 4, is set aside to remember them all, and the record of their work is preserved in accounts handed down through the centuries from place to place, especially in those locations where they labored. To tell all the stories passed down in the Church concerning the Seventy would fill a book of considerable size, but the stories of a few will convey the conviction and faith of this illustrious body. Barnabas, a Jew of the tribe of Levi, was born in Cyprus of wealthy parents. He is said to have studied under Gamaliel with Saul of Tarsus, who was to become Paul the apostle. Originally named Joseph, he was called Barnabas (Son of Consolation) by the apostles ([[ACT.4:36]]) because he had a rare gift of comforting people's hearts. He sought out Paul when everyone else was afraid of him, bringing him to the apostles. It was Barnabas whom the apostles first sent to Antioch with Paul. Their long association was broken only when Barnabas was determined to take his cousin Mark, whom Paul did not trust just then, on a missionary journey. The three were later reconciled ([[COL.4:10]]). Many ancient accounts say Barnabas was the first to preach in Rome and in Milan, but he was martyred in Cyprus, then buried by Mark at the western gate of the city of Salamis. Also among the more prominent of the Seventy was the apostle Titus, whom Paul called his brother ([[2CO.12:18]]) and his son ([[TIT.1:4]]). Born in Crete, Titus was educated in Greek philosophy, but after reading the prophet Isaiah he began to doubt the value of all he had been taught. Hearing the news of the coming of Jesus Christ, he joined some others from Crete who were going to Jerusalem to see for themselves. After hearing Jesus speak and seeing His works, the young Titus joined those who followed Him. Baptized by the apostle Paul, he worked with and served the great apostle to the Gentiles, traveling with him until Paul sent him to Crete, making him bishop of that city. It is said that Titus was in Rome at the time of the beheading of St. Paul and that he buried the body of his spiritual father before returning home. Back in Crete, he converted and baptized many people, governing the Church on that island until he entered into rest at the age of ninety-four. Many less prominent among the Seventy also labored for Christ unto death. Aristarchus, whom Paul mentions several times ([[ACT.19:29]]; [[COL.4:10]]; Phm 24), calling him a 'fellow laborer,' became bishop of Apamea in Syria. Sosthenes ([[ACT.18:17]]; [[1CO.1:1]]) became bishop of Caesarea, and Tychicus ([[ACT.20:4]]; [[EPH.6:21]]; [[COL.4:7]]; [[2TI.4:12]]; [[TIT.3:12]]) succeeded him in that city. Simeon ([[MAT.13:55]]; [[MRK.6:3]]), son of Cleopas (who was the brother of Joseph, the betrothed of the Virgin Mary), succeeded James as bishop of Jerusalem. Aristobulus ([[ROM.16:10]]), the brother of the apostle Barnabas, preached the gospel in Britain and died peacefully there. The lives of these few are quite representative of the Seventy, who were instrumental in helping to plant the Church throughout the world. Many became bishops, but the names of all are numbered in heaven in the Book of Life as faithful servants of the Lord, apostles and foundations of the Church."
    },
    {
      "source_file": "staging/validated/OT/JER_footnotes.md",
      "line_number": 1084,
      "raw_match": "[[LUK.10:1]]-20",
      "reference_type": "wikilink_range",
      "context": "seventy men to be heralds of the Gospel ([[LUK.10:1]]-20). These seventy lived a godly life of"
    }
  ]
}
