{
  "anchor_id": "MAT.28:15",
  "canon_uri": "canon/NT/MAT.md#MAT.28:15",
  "text_tradition": "LXX",
  "generated_at": "2026-03-13T21:28:41+00:00",
  "generator_version": "phase3-backlinks-v1",
  "links": [
    {
      "source_file": "staging/validated/NT/LUK_footnotes.md",
      "line_number": 2345,
      "raw_match": "[[MAT.28:11]]-15",
      "reference_type": "wikilink_range",
      "context": "dead ([[MAT.28:11]]-15; [[JOH.12:9]]-11)."
    }
  ]
}
