{
  "anchor_id": "JAS.1:15",
  "canon_uri": "canon/NT/JAS.md#JAS.1:15",
  "text_tradition": "LXX",
  "generated_at": "2026-03-13T21:28:41+00:00",
  "generator_version": "phase3-backlinks-v1",
  "links": [
    {
      "source_file": "staging/validated/OT/WIS_footnotes.md",
      "line_number": 40,
      "raw_match": "[[JAS.1:12]]-18",
      "reference_type": "wikilink_range",
      "context": "(see [[JAS.1:12]]-18)."
    }
  ]
}
