{
  "anchor_id": "2KI.9:10",
  "canon_uri": "canon/OT/2KI.md#2KI.9:10",
  "text_tradition": "LXX",
  "generated_at": "2026-03-13T21:28:41+00:00",
  "generator_version": "phase3-backlinks-v1",
  "links": [
    {
      "source_file": "staging/validated/OT/TOB_footnotes.md",
      "line_number": 60,
      "raw_match": "[[2KI.9:10]]",
      "reference_type": "wikilink",
      "context": "Not to bury the dead was seen as a curse, the ultimate in disrespect ([[2KI.9:10]]; Jer"
    }
  ]
}
