{
  "anchor_id": "PSA.70:17",
  "canon_uri": "canon/OT/PSA.md#PSA.70:17",
  "text_tradition": "LXX",
  "generated_at": "2026-03-13T21:28:41+00:00",
  "generator_version": "phase3-backlinks-v1",
  "links": [
    {
      "source_file": "staging/validated/OT/ISA_footnotes.md",
      "line_number": 997,
      "raw_match": "[[PSA.70:17]]",
      "reference_type": "wikilink",
      "context": "An encouraging promise to believers in old age, reminiscent of [[PSA.70:17]], [[PSA.70:18]]."
    }
  ]
}
